{
  "draftVersion": 1,
  "contentDirectory": "energy-crisis",
  "scenario": {
    "id": "energy_crisis",
    "title": "狐狸共和国能源危机",
    "playerRole": "狐狸共和国能源部长",
    "workspaceLabel": "能源应急指挥部",
    "opening": "首都在晚间新闻开场前陷入停电。电网公司说缺的是燃料，矿工说缺的是尊重，财政部说最缺的是一个不需要拨款的解释。总统要求你在天亮前恢复供电，或至少恢复政府对供电的定义。",
    "phases": [
      { "id": "outage", "label": "全国停电" },
      { "id": "response", "label": "紧急调度" },
      { "id": "settlement", "label": "能源协议" },
      { "id": "ending", "label": "危机后来史" }
    ],
    "historyEvaluations": [
      {
        "requirements": [{ "field": "final_outcome", "operator": "==", "value": "shared_burden" }],
        "text": "五年后的能源白皮书写道：政府让电力公司、矿工和公众共同承担成本，并让每一方都相信主要由另外两方承担。"
      },
      {
        "requirements": [{ "field": "final_outcome", "operator": "==", "value": "corporate_rescue" }],
        "text": "五年后的审计报告写道：共和国成功挽救了电网，随后用十年电费证明救助从未由纳税人承担。"
      },
      {
        "requirements": [{ "field": "final_outcome", "operator": "==", "value": "austere_recovery" }],
        "text": "五年后的纪念展写道：公众通过少用电战胜了缺电，政府则通过把短缺改名为节约战胜了公众。"
      },
      { "text": "能源危机最终被归档为一次持续时间短于调查委员会的临时事件。" }
    ],
    "playerDisplay": {
      "fields": {
        "energy_policy": {
          "emergency_imports": "紧急进口燃料",
          "price_cap": "临时电价上限",
          "rolling_rationing": "分区有序用电",
          "undecided": "尚未决定"
        },
        "final_outcome": {
          "shared_burden": "共同负担协议",
          "corporate_rescue": "电网救助方案",
          "austere_recovery": "全民节能复苏",
          "unset": "尚未定案"
        }
      }
    },
    "stateSchema": {
      "phase": "string",
      "blackout_hours": "number",
      "public_anger": "number",
      "reserve_power": "number",
      "energy_policy": "string",
      "official_terms": "string[]",
      "grid_stable": "boolean",
      "final_outcome": "string"
    },
    "initialState": {
      "phase": "outage",
      "blackout_hours": 4,
      "public_anger": 1,
      "reserve_power": 0,
      "energy_policy": "undecided",
      "official_terms": [],
      "grid_stable": false,
      "final_outcome": "unset"
    }
  },
  "actors": [
    { "id": "energy_minister", "name": "能源部长阁下", "species": "fox", "emoji": "🦊", "role": "玩家·能源部长", "institutionId": "energy_ministry" },
    { "id": "utility_ceo", "name": "格里德·长尾", "species": "squirrel", "emoji": "🐿️", "role": "国家电网公司总裁", "institutionId": "power_utility" },
    { "id": "miner_badger", "name": "布鲁诺·黑爪", "species": "badger", "emoji": "🦡", "role": "全国矿工联合会主席", "institutionId": "coal_union" },
    { "id": "energy_anchor", "name": "共和国晚间能源新闻", "species": "owl", "emoji": "📺", "role": "特别节目主播", "institutionId": "national_broadcast" },
    { "id": "energy_historian", "name": "共和国能源档案编审组", "species": "owl", "emoji": "📖", "role": "官方历史编纂者", "institutionId": "energy_archives" }
  ],
  "institutions": [
    { "id": "energy_ministry", "name": "能源部", "mission": "让共和国在需要时拥有能源", "institutional_interest": "证明每次短缺都在计划之内" },
    { "id": "power_utility", "name": "国家电网公司", "mission": "输送电力并解释账单", "institutional_interest": "获得救助同时维持市场化形象" },
    { "id": "coal_union", "name": "全国矿工联合会", "mission": "维护矿区就业与谈判权", "institutional_interest": "把能源安全转化为长期岗位" },
    { "id": "national_broadcast", "name": "共和国国家广播网", "mission": "在恢复电力后解释停电", "institutional_interest": "让危机拥有可播出的官方名称" },
    { "id": "energy_archives", "name": "国家能源档案委员会", "mission": "整理每一次临时能源安排", "institutional_interest": "把应急决定编成长期战略" }
  ],
  "events": [
    {
      "id": "EN01",
      "title": "首都突然停电",
      "type": "core",
      "thread": ["Energy", "Government"],
      "priority": 200,
      "phase": "outage",
      "actorId": "energy_minister",
      "institutionId": "energy_ministry",
      "scene": "首都已经停电四小时。电网公司要求燃料，矿区要求合同，电视台要求一间仍有电的演播室。你必须先决定政府准备把什么送进电网。",
      "choices": [
        {
          "id": "A",
          "label": "紧急进口燃料",
          "response": "第一艘燃料船尚未靠岸，外交部已经宣布供应链恢复了国际信心。",
          "effects": [
            { "field": "energy_policy", "operation": "set", "value": "emergency_imports" },
            { "field": "reserve_power", "operation": "increment", "value": 2 }
          ],
          "memories": [{ "speaker": "energy_minister", "topic": "energy_promise", "statement": "政府将不惜代价恢复全国供电。", "public": true, "importance": 4, "tags": ["energy", "promise"] }]
        },
        {
          "id": "B",
          "label": "宣布临时电价上限",
          "response": "电价停止上涨，电力公司则提醒政府，发电成本没有收到同一份命令。",
          "effects": [
            { "field": "energy_policy", "operation": "set", "value": "price_cap" },
            { "field": "public_anger", "operation": "decrement", "value": 1 }
          ],
          "debts": [{ "creditor": "power_utility", "type": "price_compensation", "topic": "utility_support", "strength": 3, "pressure": 2, "description": "电网公司等待政府补偿限价造成的成本。", "tags": ["utility", "budget"] }]
        },
        {
          "id": "C",
          "label": "立即分区限电",
          "response": "政府公布了有序用电表，所有没有电的地区都开始研究自己为何排在有序之外。",
          "effects": [
            { "field": "energy_policy", "operation": "set", "value": "rolling_rationing" },
            { "field": "public_anger", "operation": "increment", "value": 2 },
            { "field": "official_terms", "operation": "push", "value": "有序用电" }
          ]
        }
      ]
    },
    {
      "id": "EN02",
      "title": "电网公司的求救账单",
      "type": "reactive",
      "thread": ["Utility", "Budget"],
      "priority": 110,
      "phase": "response",
      "actorId": "utility_ceo",
      "institutionId": "power_utility",
      "after": ["EN01"],
      "debtTopics": ["utility_support"],
      "urgencyFields": ["public_anger"],
      "scene": "电网总裁带来一份救助清单。第一页写着‘维持国家基本供电’，后九十九页写着这句话的价格。",
      "choices": [
        {
          "id": "A",
          "label": "提供紧急担保",
          "response": "电网获得政府信用，政府获得一张未来才会知道金额的账单。",
          "effects": [{ "field": "reserve_power", "operation": "increment", "value": 2 }],
          "debts": [{ "creditor": "power_utility", "type": "bailout_guarantee", "topic": "utility_support", "strength": 4, "pressure": 2, "description": "电网公司等待紧急担保转化为正式救助。", "tags": ["utility", "promise"] }]
        },
        {
          "id": "B",
          "label": "要求公司自行承担",
          "response": "公司同意自行承担，并立即把‘自行’定义为下一季度用户账单。",
          "effects": [{ "field": "public_anger", "operation": "increment", "value": 1 }]
        }
      ]
    },
    {
      "id": "EN03",
      "title": "矿工要求能源爱国主义",
      "type": "reactive",
      "thread": ["Labor", "Energy"],
      "priority": 110,
      "phase": "response",
      "actorId": "miner_badger",
      "institutionId": "coal_union",
      "after": ["EN01"],
      "urgencyFields": ["blackout_hours"],
      "scene": "矿工联合会愿意重启封存矿井，条件是政府承认每一份临时岗位都具有永久的国家意义。",
      "choices": [
        {
          "id": "A",
          "label": "重启两座旧矿井",
          "response": "矿井恢复生产，环境评估则被安排在危机结束后评估自己是否仍有必要。",
          "effects": [{ "field": "reserve_power", "operation": "increment", "value": 3 }],
          "debts": [{ "creditor": "coal_union", "type": "jobs_commitment", "topic": "miner_jobs", "strength": 3, "pressure": 2, "description": "矿工要求临时复产岗位得到长期保障。", "tags": ["labor", "jobs"] }]
        },
        {
          "id": "B",
          "label": "只接受短期库存",
          "response": "工会同意提供库存，并把每一车煤都附上一份长期谈判邀请。",
          "effects": [
            { "field": "reserve_power", "operation": "increment", "value": 1 },
            { "field": "public_anger", "operation": "increment", "value": 1 }
          ]
        }
      ]
    },
    {
      "id": "EN04",
      "title": "为停电选择正式名称",
      "type": "core",
      "thread": ["Media", "Government"],
      "priority": 160,
      "phase": "settlement",
      "actorId": "energy_anchor",
      "institutionId": "national_broadcast",
      "after": ["EN02", "EN03"],
      "memoryTopics": ["energy_promise"],
      "scene": "晚间新闻终于恢复播出。主播问这究竟是‘全国停电’，还是一场被公众误解的能源管理成果。",
      "choices": [
        {
          "id": "A",
          "label": "称为“能源安全调整”",
          "response": "字幕变短了停电时间，并显著延长了政府解释。",
          "effects": [{ "field": "official_terms", "operation": "push", "value": "能源安全调整" }],
          "memories": [{ "speaker": "energy_minister", "topic": "official_energy_wording", "statement": "共和国正在进行能源安全调整。", "public": true, "importance": 4, "tags": ["media", "wording"] }]
        },
        {
          "id": "B",
          "label": "承认是“全国供电危机”",
          "response": "公众欢迎诚实，市场则要求政府解释诚实是否会持续。",
          "effects": [
            { "field": "official_terms", "operation": "push", "value": "全国供电危机" },
            { "field": "public_anger", "operation": "decrement", "value": 1 }
          ],
          "memories": [{ "speaker": "energy_minister", "topic": "official_energy_wording", "statement": "共和国正面对一场全国供电危机。", "public": true, "importance": 5, "tags": ["media", "honesty"] }]
        }
      ]
    },
    {
      "id": "EN05",
      "title": "黎明前的能源协议",
      "type": "debt",
      "thread": ["Settlement", "Debt"],
      "priority": 180,
      "phase": "settlement",
      "actorId": "energy_minister",
      "institutionId": "energy_ministry",
      "after": ["EN04"],
      "debtTopics": ["utility_support", "miner_jobs"],
      "urgencyFields": ["public_anger", "blackout_hours"],
      "scene": "电网公司、矿工和财政部都带来了最终方案。每份方案都能恢复供电，区别只在于未来由谁坚持这不是自己的成本。",
      "choices": [
        {
          "id": "A",
          "label": "签署共同负担协议",
          "response": "三方共同承担成本，并各自发布图表证明自己的份额最小。",
          "effects": [
            { "field": "grid_stable", "operation": "set", "value": true },
            { "field": "final_outcome", "operation": "set", "value": "shared_burden" }
          ],
          "debtActions": [
            { "action": "resolve", "topic": "utility_support" },
            { "action": "resolve", "topic": "miner_jobs" }
          ]
        },
        {
          "id": "B",
          "label": "优先救助国家电网",
          "response": "灯亮了，账单也亮了；政府宣布两者都是恢复信心的信号。",
          "effects": [
            { "field": "grid_stable", "operation": "set", "value": true },